Carimbo de data/hora,Endereço de e-mail,Tutor/técnico que realizou o acompanhamento:,Selecione o nome do formador acompanhado: ,E-mail institucional do formador observado (utilize o endereço @escola.pr.gov.br cadastrado no Google Sala de Aula) ,Qual a Ação de Acompanhamento a ser registrada:,Ação Observada:,Data da Observação:,Link da Ação Observada:,Data do Feedback:,Link do Feedback:,Links complementares à observação:,Rubrica - DIÁLOGO FORMATIVO [CRITÉRIO 1 – Planejamento e prazo do desenvolvimento do diálogo formativo.],Rubrica - DIÁLOGO FORMATIVO [CRITÉRIO 2 – Etapas do diálogo formativo],Rubrica - DIÁLOGO FORMATIVO [CRITÉRIO 3 – Desenvolvimento por meio dos materiais formativos],Rubrica - DIÁLOGO FORMATIVO [CRITÉRIO 4 – Questionamentos propositivos],Rubrica - DIÁLOGO FORMATIVO [CRITÉRIO 5 – Análise a partir de evidências],Rubrica - DIÁLOGO FORMATIVO [CRITÉRIO 6 – Acolhimento e escuta ativa],Rubrica - DIÁLOGO FORMATIVO [CRITÉRIO 7 – Mediação de conflitos],Rubrica - DIÁLOGO FORMATIVO [CRITÉRIO 8 – Sugestão de Materiais e Repertório],Rubrica - DIÁLOGO FORMATIVO [CRITÉRIO 9 – Construção Conjunta de Combinados],Rubrica - DIÁLOGO FORMATIVO [CRITÉRIO 10 – Gestão do Tempo do Atendimento (10 a 20 min)],Rubrica - DEVOLUTIVA [CRITÉRIO 1 – Planejamento e prazo do desenvolvimento da devolutiva.],Rubrica - DEVOLUTIVA [CRITÉRIO 2 – Etapas da devolutiva],Rubrica - DEVOLUTIVA [CRITÉRIO 3 – Desenvolvimento por meio dos materiais formativos],Rubrica - DEVOLUTIVA [CRITÉRIO 4 – Análise a partir de evidências],Rubrica - DEVOLUTIVA [CRITÉRIO 5 – Sugestão de Materiais e Repertório],Rubrica - DEVOLUTIVA [CRITÉRIO 6 – Gestão do Tempo da Ação (5 a 10 min)],Rubrica - ENCONTRO FORMATIVO [CRITÉRIO 1 – Condução do encontro formativo a partir do roteiro],Rubrica - ENCONTRO FORMATIVO [CRITÉRIO 2 – Orientação a partir do PDP e rubrica],Rubrica - ENCONTRO FORMATIVO [CRITÉRIO 3 – Transposição Didática e Contextualização Prática],Rubrica - ENCONTRO FORMATIVO [CRITÉRIO 4 – Gestão da interação],Rubrica - ENCONTRO FORMATIVO [CRITÉRIO 5 – Comunicação e clima formativo],Rubrica - ENCONTRO FORMATIVO [CRITÉRIO 6 – Competência digital],Rubrica - ENCONTRO FORMATIVO [CRITÉRIO 7 – Gestão do tempo],CHECKLIST - A CADA TEMA: Marque as ações que o Formador realizou corretamente.,Agora marque as ações que o formador não realizou adequadamente neste tema:,Outros registros adicionais em relação as AÇÕES OPERACIONAIS (pontos fortes ou a desenvolver não cobertos no checklist),"A partir da observação e do preenchimento da rubrica, quais são as habilidades de maior destaque do formador?","A partir da observação e do preenchimento da rubrica, quais são as habilidades que ainda precisam ser desenvolvidas pelo formador?",Registre aqui os encaminhamentos/sugestões/combinados firmados a partir do feedback?
08/06/2026 16:41:39,mariangela.iurk@escola.pr.gov.br,Mariangela Ceschim Iurk,IZABEL CRISTINA MARSON,marson.izabel@escola.pr.gov.br,"Observação da prática (Diálogo Formativo, Devolutiva ou Encontro Formativo).",Diálogo Formativo.,12/05/2026,vbvcb,19/05/2026,vcbvcb,,🔴 NÃO ATENDEU,🔴 NÃO ATENDEU,🔴 NÃO ATENDEU,🔴 NÃO ATENDEU,🔴 NÃO ATENDEU,🔴 NÃO ATENDEU,🔴 NÃO ATENDEU,🔴 NÃO ATENDEU,🔴 NÃO ATENDEU,🔴 NÃO ATENDEU,,,,,,,,,,,,,,,,,dsfsdzf,fgzdfg,\sdfs
08/06/2026 16:49:05,estagioprobatorio@escola.pr.gov.br,Eliane de Fatima Bruning,MARCIA BOIKO DOS SANTOS,marcia.santos91862442991@escola.pr.gov.br,"Observação da prática (Diálogo Formativo, Devolutiva ou Encontro Formativo).",Diálogo Formativo.,01/06/2026,fffffkll,03/06/2026,hgjghjghk,fkju,🟠 ATENDEU PARCIALMENTE,🟠 ATENDEU PARCIALMENTE,🟠 ATENDEU PARCIALMENTE,🟠 ATENDEU PARCIALMENTE,🟠 ATENDEU PARCIALMENTE,🟠 ATENDEU PARCIALMENTE,🟠 ATENDEU PARCIALMENTE,🟠 ATENDEU PARCIALMENTE,🟠 ATENDEU PARCIALMENTE,🟠 ATENDEU PARCIALMENTE,,,,,,,,,,,,,,,,,empatia,gestão do tempo,"Orientar professora sobre gestão de sala de aula, cuidar da gestão do tempo, renomear arquivos conforme padrão, fazer enriquecimento, assistir as próprias práticas, usar IA pra elaborar questionamentos propositivos."
08/06/2026 21:08:22,estagioprobatorio@escola.pr.gov.br,Caroline Marzani,ALESSANDRA VAZ TOMAZ KUPLENS,teste@escola.pr.gov.br,"Observação da prática (Diálogo Formativo, Devolutiva ou Encontro Formativo).",Diálogo Formativo.,02/06/2026,teste,08/06/2026,teste,teste,🟠 ATENDEU PARCIALMENTE,🟢 ATENDEU INTEGRALMENTE,🟠 ATENDEU PARCIALMENTE,🟢 ATENDEU INTEGRALMENTE,🔵 SUPEROU,🔵 SUPEROU,🟢 ATENDEU INTEGRALMENTE,🟠 ATENDEU PARCIALMENTE,⚪ NÃO OBSERVADO,🟢 ATENDEU INTEGRALMENTE,,,,,,,,,,,,,,,,,"Teste, teste, teste, teste, teste, teste, teste, teste, teste, teste, teste, teste, teste, teste, teste, teste, teste, teste, teste, teste, teste, teste, teste, teste, teste, teste, teste, teste, teste, teste, teste, teste, teste, teste, teste, teste, teste, teste, teste, teste, teste, teste, teste, teste, teste, teste, teste, teste, teste, teste, teste, teste, teste, teste, teste, teste, teste, teste, teste, teste, teste, teste, teste, teste, teste, teste, teste, teste, teste, teste, teste, teste, teste, teste, teste, teste, teste, teste, teste, teste, teste, teste, teste, teste, teste, teste, teste, teste, teste.","teste, teste, teste, teste, teste, teste, teste, teste, teste, teste, teste, teste, teste, teste, teste, teste, teste, teste, teste, teste, teste, teste, teste, teste, teste, teste, teste, teste, teste, teste, teste, teste, teste, teste.","teste, teste, teste, teste, teste, teste, teste, teste, teste, teste, teste, teste, teste, teste, teste, teste, teste, teste, teste, teste, teste, teste, teste, teste, teste, teste, teste, teste, teste, teste, teste, teste, teste, teste, teste, teste, teste, teste, teste, testeteste, teste, teste, teste, teste, teste, teste, teste, teste, teste, teste, teste, teste, teste, teste, teste, teste, teste, teste, teste, teste, teste, teste, teste, teste, teste, teste, teste, teste, teste, teste, teste, teste, teste, teste, teste, teste, teste, teste, teste, teste, teste, teste, teste, teste, teste, teste, teste, teste, teste, teste, teste, teste, teste, teste, teste, teste, teste, teste, teste, teste, teste, teste, teste, teste, teste, teste, teste, teste, teste."
08/06/2026 21:10:22,estagioprobatorio@escola.pr.gov.br,Ester Clara Neotti,ELEDIANE DE TONI,teste@escola.pr.gov.br,"Observação da prática (Diálogo Formativo, Devolutiva ou Encontro Formativo).",Devolutiva.,03/06/2026,teste,04/06/2026,teste,,,,,,,,,,,,🔵 SUPEROU,🟢 ATENDEU INTEGRALMENTE,🟢 ATENDEU INTEGRALMENTE,🔵 SUPEROU,🟠 ATENDEU PARCIALMENTE,🟢 ATENDEU INTEGRALMENTE,,,,,,,,,,,"teste, teste,teste, teste,teste, teste,teste, teste,teste, teste,teste, teste,teste, teste,teste, teste,teste, teste,teste, teste,teste, teste,teste, teste,teste, teste,teste, teste,teste, teste,teste, teste,teste, teste,teste, teste,teste, teste,teste, teste,teste, teste,teste, teste,teste, teste.","teste, teste, teste, teste, teste, teste, teste, teste, teste, teste, teste, teste, teste, teste, teste, teste, teste, teste, teste, teste, teste, teste, teste, teste, teste, teste, teste, teste, teste, teste, teste, teste, teste, teste, teste, teste, teste, teste, teste, teste, teste, teste, teste, teste, teste, teste, teste, teste, teste, teste, teste, teste, teste, teste, teste, teste, teste, teste, teste, teste, teste, teste, teste, teste, teste, teste, teste, teste, teste, teste, teste, teste, teste, teste, teste, teste, teste, teste, teste, teste, teste, teste, teste, teste, teste, teste, teste, teste, teste, teste, teste, teste, teste, teste, teste, teste, teste, teste, teste, teste, teste, teste, teste, teste, teste, teste, teste, teste, teste, teste, teste, teste, teste, teste, teste, teste, teste, teste, teste, teste, teste, teste, teste, teste, teste, teste, teste, teste, teste, teste, teste, teste, teste, teste, teste, teste, teste, teste, teste, teste, teste, teste, teste, teste, teste, teste, teste, teste, teste, teste, teste, teste, teste, teste, teste, teste, teste, teste, teste, teste.","teste, teste, teste, teste, teste, teste, teste, teste, teste, teste, teste, teste, teste, teste, teste, teste, teste, teste, teste, teste, teste, teste, teste, teste, teste, teste, teste, teste, teste, teste, teste, teste, teste, teste, teste, teste, teste, teste, teste, teste, teste, teste, teste, teste, teste, teste, teste, teste, teste, teste, teste, teste, teste, teste, teste, teste, teste, teste, teste, teste, teste, teste, teste, teste, teste, teste, teste, teste, teste, teste, teste, teste, teste, teste, teste, teste, teste, teste, teste, teste, teste, teste, teste, teste, teste, teste, teste, teste, teste, teste, teste, teste, teste, teste, teste, teste, teste, teste, teste, teste, teste, teste, teste, teste, teste, teste, teste, teste, teste, teste, teste, teste, teste, teste, teste, teste, teste, teste, teste, teste, teste, teste, teste, teste, teste, teste, teste, teste, teste, teste, teste, teste, teste, teste, teste, teste, teste, teste, teste, teste, teste, teste, teste, teste, teste, teste, teste, teste, teste, teste, teste, teste, teste, teste, teste, teste, teste, teste, teste, teste, teste, teste, teste, teste, teste, teste, teste, teste, teste, teste, teste, teste, teste, teste, teste, teste, teste, teste, teste, teste, teste, teste."
08/06/2026 21:12:04,estagioprobatorio@escola.pr.gov.br,Karen Angélica Sonego Trevisan,JOATE GRAZIANNA GELBCKE RAMOS,teste@escola.pr.gov.br,"Observação da prática (Diálogo Formativo, Devolutiva ou Encontro Formativo).",Encontro Formativo.,04/06/2026,teste,12/06/2026,teste,,,,,,,,,,,,,,,,,,🟠 ATENDEU PARCIALMENTE,🔵 SUPEROU,🔵 SUPEROU,🟢 ATENDEU INTEGRALMENTE,🔵 SUPEROU,🟢 ATENDEU INTEGRALMENTE,🟢 ATENDEU INTEGRALMENTE,,,,"teste, teste, teste, teste, teste, teste, teste, teste, teste, teste, teste, teste, teste, teste, teste, teste, teste, teste, teste, teste, teste, teste, teste, teste, teste, teste, teste, teste, teste, teste, teste, teste, teste, teste, teste, teste, teste, teste, teste, teste, teste, teste, teste, teste, teste, teste, teste, teste, teste, teste, teste, teste, teste, teste, teste, teste, teste, teste, teste, teste, teste, teste, teste, teste, teste, teste, teste, teste, teste, teste, teste, teste, teste, teste, teste, teste, teste, teste, teste, teste, teste, teste, teste, teste, teste, teste, teste, teste, teste, teste, teste, teste, teste, teste, teste, teste, teste, teste, teste, teste, teste, teste, teste, teste, teste, teste, teste, teste, teste, teste, teste, teste, teste, teste, teste, teste, teste, teste, teste, teste, teste, teste, teste, teste, teste, teste, teste, teste, teste, teste, teste, teste, teste, teste, teste, teste, teste, teste, teste, teste, teste, teste, teste, teste, teste, teste, teste, teste, teste, teste, teste, teste, teste, teste, teste, teste, teste, teste, teste, teste, teste, teste, teste, teste, teste, teste, teste, teste, teste, teste, teste, teste, teste, teste, teste, teste, teste, teste, teste, teste, teste, teste, teste, teste, teste, teste, teste, teste, teste, teste, teste, teste, teste, teste, teste, teste, teste, teste, teste, teste, teste, teste, teste, teste, teste, teste, teste, teste, teste, teste, teste, teste, teste, teste, teste, teste, teste, teste, teste, teste, teste, teste, teste, teste, teste, teste, teste, teste, teste, teste, teste, teste.","teste, teste, teste, teste, teste, teste, teste, teste, teste, teste, teste, teste, teste, teste, teste, teste, teste, teste, teste, teste, teste, teste, teste, teste, teste, teste, teste, teste, teste, teste, teste, teste, teste, teste, teste, teste, teste, teste, teste, teste, teste, teste, teste, teste, teste, teste, teste, teste, teste, teste, teste, teste, teste, teste, teste, teste, teste, teste, teste, teste, teste, teste, teste, teste, teste, teste, teste, teste, teste, teste, teste, teste, teste, teste, teste, teste, teste, teste, teste, teste, teste, teste, teste, teste, teste, teste, teste, teste, teste, teste, teste, teste, teste, teste, teste, teste, teste, teste, teste, teste, teste, teste, teste, teste, teste, teste, teste, teste, teste, teste, teste, teste, teste, teste, teste, teste, teste, teste, teste, teste, teste, teste, teste, teste, teste, teste, teste, teste, teste, teste, teste, teste, teste, teste, teste, teste, teste, teste, teste, teste, teste, teste, teste, teste, teste, teste, teste, teste, teste, teste, teste, teste, teste, teste, teste, teste, teste, teste, teste, teste, teste, teste, teste, teste, teste, teste, teste, teste, teste, teste, teste, teste, teste, teste, teste, teste, teste, teste, teste, teste, teste, teste, teste, teste, teste, teste, teste, teste, teste, teste, teste, teste, teste, teste, teste, teste, teste, teste, teste, teste, teste, teste, teste, teste, teste, teste, teste, teste, teste, teste, teste, teste, teste, teste, teste, teste, teste, teste, teste, teste, teste, teste, teste, teste, teste, teste, teste, teste, teste, teste, teste, teste, teste, teste, teste, teste, teste, teste, teste, teste, teste, teste, teste, teste, teste, teste, teste, teste, teste, teste, teste, teste, teste, teste, teste, teste.","teste, teste, teste, teste, teste, teste, teste, teste, teste, teste, teste, teste, teste, teste, teste, teste, teste, teste, teste, teste, teste, teste, teste, teste, teste, teste, teste, teste, teste, teste, teste, teste, teste, teste, teste, teste, teste, teste, teste, teste, teste, teste, teste, teste, teste, teste, teste, teste, teste, teste, teste, teste, teste, teste, teste, teste, teste, teste, teste, teste, teste, teste, teste, teste, teste, teste, teste, teste, teste, teste, teste, teste, teste, teste, teste, teste, teste, teste, teste, teste, teste, teste, teste, teste, teste, teste, teste, teste, teste, teste, teste, teste, teste, teste, teste, teste."
08/06/2026 21:13:15,estagioprobatorio@escola.pr.gov.br,Meiriele Roberto Tomal,NIVIA MARIA DACIUK SCHOENHERR,teste@escola.pr.gov.br,Checklist - Ações Operacionais.,,,,,,,,,,,,,,,,,,,,,,,,,,,,,,"Criação de Playlists (Nome no padrão: ESTÁGIO PROBATÓRIO_NOME DO FORMADOR_MODALIDADE_ANO_COMPONENTE_TURMA_2026), Padronização do nome da turma no Classroom (Padrão: EP_DOC/EQG/TEC_1ANO/2e3ANO_COMPONENTE-TURNO-TURMA), Convocação para Encontros (Link, roteiro e horário postados no mural com antecedência mínima de 24h), Registros no LRCO (Frequência, tema e objetivos lançados imediatamente após o encontro, ou frase padrão para semanas sem encontro), Nomenclatura de Arquivos (Vídeos subidos na playlist correta e renomeados conforme Anexo I), Combinados de Feedback (Formador orientou o preenchimento do campo 'Organização para Observação e Feedback' no PDP/Planejamento), Priorização do Diálogo (Priorizou o Diálogo Formativo, ou justificou a Devolutiva), Alinhamento Pedagógico (Presença confirmada nas reuniões de apresentação de roteiro e alinhamento)","Registro de Observação (Instrumento de registro preenchido e link do vídeo inserido no campo específico), Priorização do Diálogo (Priorizou o Diálogo Formativo, ou justificou a Devolutiva), Tempo Regulamentar (Diálogo 10-20 min / Devolutiva 5-10 min / Observação Síncrona 10-15 min)","teste, teste, teste, teste, teste, teste, teste, teste, teste, teste, teste, teste, teste, teste, teste, teste, teste, teste, teste, teste, teste, teste, teste, teste, teste, teste, teste, teste, teste, teste, teste, teste, teste, teste, teste, teste, teste, teste, teste, teste, teste, teste, teste, teste, teste, teste, teste, teste, teste, teste, teste, teste, teste, teste, teste, teste, teste, teste, teste, teste, teste, teste, teste, teste, teste, teste, teste, teste, teste, teste, teste, teste, teste, teste, teste, teste, teste, teste, teste, teste, teste, teste, teste, teste, teste, teste, teste, teste, teste, teste, teste, teste, teste, teste, teste, teste, teste, teste, teste, teste, teste, teste, teste, teste, teste, teste, teste, teste, teste, teste, teste, teste, teste, teste, teste, teste, teste, teste, teste, teste, teste, teste, teste, teste, teste, teste, teste, teste, teste, teste, teste, teste, teste, teste, teste, teste, teste, teste, teste, teste, teste, teste, teste, teste, teste, teste, teste, teste, teste, teste, teste, teste, teste, teste, teste, teste, teste, teste.",,,
08/06/2026 21:14:50,estagioprobatorio@escola.pr.gov.br,Leonilda de Fátima Portela do Vale,VALERIA PAULA OLIVEIRA BONADIO COSTA,teste@escola.pr.gov.br,"Observação da prática (Diálogo Formativo, Devolutiva ou Encontro Formativo).",Diálogo Formativo.,03/06/2026,teste,04/06/2026,teste,teste,🟢 ATENDEU INTEGRALMENTE,🔵 SUPEROU,🟢 ATENDEU INTEGRALMENTE,🟠 ATENDEU PARCIALMENTE,🟢 ATENDEU INTEGRALMENTE,🟢 ATENDEU INTEGRALMENTE,🟠 ATENDEU PARCIALMENTE,🔵 SUPEROU,🟢 ATENDEU INTEGRALMENTE,🟠 ATENDEU PARCIALMENTE,,,,,,,,,,,,,,,,,"teste, teste, teste, teste, teste, teste, teste, teste, teste, teste, teste, teste, teste, teste, teste, teste, teste, teste, teste, teste, teste, teste, teste, teste, teste, teste, teste, teste, teste, teste, teste, teste, teste, teste, teste, teste, teste, teste, teste, teste, teste, teste, teste, teste, teste, teste, teste, teste, teste, teste, teste, teste, teste, teste.","teste, teste, teste, teste, teste, teste, teste, teste, teste, teste, teste, teste, teste, teste, teste, teste, teste, teste, teste, teste, teste, teste, teste, teste, teste, teste, teste, teste, teste, teste, teste, teste, teste, teste, teste, teste.","teste, teste, teste, teste, teste, teste, teste, teste, teste, teste, teste, teste, teste, teste, teste, teste, teste, teste, teste, teste, teste, teste, teste, teste, teste, teste, teste, teste, teste, teste."
10/06/2026 08:07:33,mariangela.iurk@escola.pr.gov.br,Mariangela Ceschim Iurk,ADRIANA FELIX DOS ANJOS,ncvcvb@escola.pr,"Observação da prática (Diálogo Formativo, Devolutiva ou Encontro Formativo).",Diálogo Formativo.,03/06/2026,dfsdfsd,03/06/2026,afssdfds,dfdsf,⚪ NÃO OBSERVADO,🟢 ATENDEU INTEGRALMENTE,⚪ NÃO OBSERVADO,🟠 ATENDEU PARCIALMENTE,⚪ NÃO OBSERVADO,⚪ NÃO OBSERVADO,🟠 ATENDEU PARCIALMENTE,🟠 ATENDEU PARCIALMENTE,⚪ NÃO OBSERVADO,⚪ NÃO OBSERVADO,,,,,,,,,,,,,,,,,Scfsd\,Sfdsf,dfgdfg